{
  "version": 2,
  "job_id": "series-1788166763252-p2",
  "source": {
    "kind": "magnet",
    "value": "magnet:?xt=urn:btih:7df2b0afa9d65419941b112287e24f15c8bd77cf&dn=%5BAnime%20Time%5D%20Death%20Note%20%28Series%20%26%20Movies%20%2B%20NCOP%20%26%20NCED%20%2B%20OST%29%20%5BAAC%5D%20BD%5D%5BDual-Audio%2CEng%20Sub%5D%20%5BBatch%5D&tr=http%3A%2F%2Fnyaa.tracker.wf%3A7777%2Fannounce&tr=udp%3A%2F%2Fopen.stealth.si%3A80%2Fannounce&tr=udp%3A%2F%2Ftracker.opentrackr.org%3A1337%2Fannounce&tr=udp%3A%2F%2Fexodus.desync.com%3A6969%2Fannounce&tr=udp%3A%2F%2Ftracker.torrent.eu.org%3A451%2Fannounce",
    "torrent_file_index": "7"
  },
  "options": {
    "whisper_model": "base",
    "language": "auto",
    "task": "translate_to_english",
    "target_duration_seconds": 120,
    "focus": "",
    "enable_vision_assist": true
  },
  "mode": "manual",
  "series": {
    "enabled": true,
    "series_id": "series-1788166763252",
    "source_job_id": "manual-1788166744884",
    "part": 2,
    "start_seconds": 343,
    "context": "Prior events (Part 1): Light discovers that Shoko Maki knows the secret of the bus jacking and attempts to eliminate her with the Death Note, only to realize in horror that her name is a fake alias."
  },
  "music": {
    "ref": "audio-library/SUA CAVALONA (Hardstyle Remix) (Ultra Slowed).m4a",
    "source": "default"
  },
  "saved_at_epoch": 1788178281
}
