{
  "version": 2,
  "job_id": "manual-1791193815835",
  "source": {
    "kind": "torrent_file",
    "value": "path:jobs\/manual-1791193815835\/source.torrent",
    "torrent_file_index": "7"
  },
  "options": {
    "whisper_model": "base",
    "language": "auto",
    "task": "translate_to_english",
    "target_duration_seconds": 30,
    "focus": "",
    "enable_vision_assist": true
  },
  "mode": "manual",
  "series": {
    "enabled": true,
    "series_id": "HODT2",
    "source_job_id": "manual-1791193815835",
    "part": 1,
    "start_seconds": 0,
    "context": "",
    "super_series": true
  },
  "music": {
    "ref": "audio-library\/yung_kai_-_blue_(official_audio).m4a",
    "source": "explicit_library"
  },
  "saved_at_epoch": 1791196251
}