{
  "version": 2,
  "job_id": "manual-1791324584553",
  "source": {
    "kind": "url",
    "value": "https:\/\/drive.kayoani.online\/download.aspx?file=jXXqmOp4qzCVynfTsK8s%2BqBL55VSa7zCggxmYkfRu4LZ8D7CVo28E6%2FdLVS34%2F7f&expiry=Uxnd0OWMw2qIw36HCu%2Bl2w%3D%3D&mac=3e8982a7b60bdc3133de2e5d56ff44cacafac9f99386258277f40a1492474eea"
  },
  "options": {
    "whisper_model": "base",
    "language": "auto",
    "task": "translate_to_english",
    "target_duration_seconds": 30,
    "focus": "",
    "enable_vision_assist": true
  },
  "mode": "manual",
  "series": {
    "enabled": true,
    "series_id": "hxh1",
    "source_job_id": "manual-1791324584553",
    "part": 1,
    "start_seconds": 0,
    "context": "",
    "super_series": true
  },
  "music": {
    "ref": "audio-library\/yung_kai_-_blue_(official_audio).m4a",
    "source": "explicit_library"
  },
  "saved_at_epoch": 1791324584
}