{
  "version": 2,
  "job_id": "manual-1789372351898",
  "source": {
    "kind": "magnet",
    "value": "magnet:?xt=urn:btih:9079b2a05588a620ece651042807f17513661a75&dn=Rick and Morty - S03 - 2160p HDR Ai Upscale -Mesc&xl=15731081877&tr=https:\/\/seedpool.org\/announce\/9b684f045f3361654d93e5f1bd3514e7&tr=udp:\/\/open.stealth.si:80\/announce&tr=udp:\/\/tracker.opentrackr.org:1337\/announce&tr=udp:\/\/tracker.torrent.eu.org:451\/announce&tr=udp:\/\/explodie.org:6969\/announce&tr=udp:\/\/ttk2.nbaonlineservice.com:6969\/announce&tr=udp:\/\/ec2-18-191-163-220.us-east-2.compute.amazonaws.com:6969\/announce",
    "torrent_file_index": "9"
  },
  "options": {
    "whisper_model": "base",
    "language": "auto",
    "task": "translate_to_english",
    "target_duration_seconds": 30,
    "focus": "",
    "enable_vision_assist": true
  },
  "mode": "manual",
  "series": {
    "enabled": true,
    "series_id": "Rick",
    "source_job_id": "manual-1789372351898",
    "part": 1,
    "start_seconds": 0,
    "context": "",
    "super_series": true
  },
  "music": {
    "ref": "audio-library\/Golden Brown - The Stranglers (slowed + reverb).m4a",
    "source": "explicit_library"
  },
  "saved_at_epoch": 1789372489
}