{
  "source": {
    "kind": "torrent_file",
    "value": "path:jobs\/manual-1790840907285\/source.torrent",
    "torrent_file_index": "12"
  },
  "options": {
    "whisper_model": "base",
    "language": "auto",
    "task": "translate_to_english",
    "target_duration_seconds": 30,
    "focus": "",
    "enable_vision_assist": true
  },
  "mode": "manual",
  "series": {
    "enabled": true,
    "series_id": "hyakkano12",
    "source_job_id": "manual-1790840907285",
    "part": 1,
    "start_seconds": 0,
    "context": "(No prior summaries.)"
  },
  "music": {
    "ref": "audio-library\/yung_kai_-_blue_(official_audio).m4a",
    "source": "explicit_library"
  },
  "version": 2,
  "job_id": "hyakkano12-p1",
  "saved_at_epoch": 1790921274
}