{
  "version": 2,
  "job_id": "series-1789040069424-p6",
  "source": {
    "kind": "magnet",
    "value": "magnet:?xt=urn:btih:27cf2c9ca13de0b4cebdf07df1369fab2e68e238&dn=Rick and Morty S09E10 Field of Dreams 1080p AMZN WEB-DL DDP5 1 H 264-FLUX[eztvx.to]&tr=udp://tracker.opentrackr.org:1337/announce&tr=udp://open.stealth.si:80/announce&tr=udp://tracker.torrent.eu.org:451/announce&tr=udp://tracker.dler.org:6969/announce&tr=https://tracker.moeblog.cn:443/announce&tr=https://tracker.zhuqiy.com:443/announce&tr=udp://open.dstud.io:6969/announce"
  },
  "options": {
    "whisper_model": "base",
    "language": "auto",
    "task": "translate_to_english",
    "target_duration_seconds": 30,
    "focus": "",
    "enable_vision_assist": true
  },
  "mode": "manual",
  "series": {
    "enabled": true,
    "series_id": "series-1789040069424",
    "source_job_id": "manual-1789040051954",
    "part": 6,
    "start_seconds": 1128,
    "context": "Prior events (Part 1): Morty is welcomed by a family whose lost son he resembles, then pressured to destroy his way home.\nPrior events (Part 2): Morty is forced into the woods to make him strong enough to stay, where he finds a journal and a possible path home.\nPrior events (Part 3): Morty escapes the woods and tracks Rick to MIT, only to discover Rick locked away his multiverse research and gave up science for Alcoholics Anonymous.\nPrior events (Part 4): Morty discovers Rick living a peaceful, sober life with his new wife who encourages him to help Morty return home, unaware that the foster mother from the woods has tracked Morty to Boston.\nPrior events (Part 5): Professor Sanchez breaks his sobriety to build Morty a portal home, but the foster family ambushes them before a lethal test reveals the rift is deadly."
  },
  "music": {
    "ref": "audio-library/Cinematic_Documentary_Chill_by_Infraction_Copyright_Free_Music_Silver.m4a",
    "source": "default"
  },
  "saved_at_epoch": 1789087867
}
