{
  "version": 2,
  "job_id": "manual-1788818277664",
  "source": {
    "kind": "magnet",
    "value": "magnet:?xt=urn:btih:0D3239056B5161E6B7C6CFF42E15D93911235EE0&dn=Gravity Falls S01 REPACK 1080p DSNP WEB-DL DD+ 5.1 H.264-ViETNAM&tr=udp://tracker.coppersurfer.tk:6969/announce&tr=udp://9.rarbg.me:2850/announce&tr=udp://9.rarbg.to:2920/announce&tr=udp://tracker.opentrackr.org:1337&tr=udp://tracker.leechers-paradise.org:6969/announce",
    "torrent_file_index": "19"
  },
  "options": {
    "whisper_model": "base",
    "language": "auto",
    "task": "translate_to_english",
    "target_duration_seconds": 60,
    "focus": "",
    "enable_vision_assist": true
  },
  "mode": "manual",
  "series": {
    "enabled": true,
    "series_id": "series-1788818491776",
    "source_job_id": "manual-1788818277664",
    "part": 1,
    "start_seconds": 0,
    "context": ""
  },
  "music": {
    "ref": "audio-library/ward wills x peachy! - samantha.m4a",
    "source": "default"
  },
  "saved_at_epoch": 1788821445
}
