{
  "version": 2,
  "job_id": "manual-1788020969411",
  "source": {
    "kind": "magnet",
    "value": "magnet:?xt=urn:btih:a8241ce7ca6513d1b8b5cf81ed10667018948eb4&dn=Rick and Morty S02E04 Total Rickall 1080p HMAX WEB-DL DD5 1 H 264-PHOENiX [ UIndex.org ]&tr=udp://tracker.bittor.pw:1337/announce&tr=udp://tracker.opentrackr.org:1337/announce&tr=udp://tracker.dler.org:6969/announce&tr=udp://open.stealth.si:80/announce&tr=udp://tracker.torrent.eu.org:451/announce&tr=udp://exodus.desync.com:6969/announce&tr=udp://open.demonii.com:1337/announce"
  },
  "options": {
    "whisper_model": "base",
    "language": "auto",
    "target_duration_seconds": 60,
    "focus": "",
    "enable_vision_assist": true
  },
  "mode": "manual",
  "series": {
    "enabled": true,
    "series_id": "series-1788020980532",
    "source_job_id": "manual-1788020969411",
    "part": 1,
    "start_seconds": 0,
    "context": ""
  },
  "music": {
    "ref": "audio-library/180DB_ [130] (Intro Slowed).m4a",
    "source": "default"
  },
  "saved_at_epoch": 1788020980
}
