{
  "version": 2,
  "job_id": "series-1789002249271-p2",
  "source": {
    "kind": "torrent_file",
    "value": "path:jobs/manual-1789002135775/source.torrent",
    "torrent_file_index": "49"
  },
  "options": {
    "whisper_model": "base",
    "language": "auto",
    "task": "translate_to_english",
    "target_duration_seconds": 60,
    "focus": "",
    "enable_vision_assist": true
  },
  "mode": "manual",
  "series": {
    "enabled": true,
    "series_id": "series-1789002249271",
    "source_job_id": "manual-1789002135775",
    "part": 2,
    "start_seconds": 1142,
    "context": "Prior events (Part 1): Kurapika turns a nighttime ambush against its attackers, while Hisoka appears above the city with an unknown plan."
  },
  "music": {
    "ref": "audio-library/180DB_ [130] (Intro Slowed).m4a",
    "source": "explicit_library"
  },
  "saved_at_epoch": 1789026329
}
