{
  "source": {
    "kind": "torrent_file",
    "value": "path:jobs\/manual-1792270006310\/source.torrent",
    "torrent_file_index": "7"
  },
  "options": {
    "whisper_model": "base",
    "language": "auto",
    "task": "translate_to_english",
    "target_duration_seconds": 30,
    "focus": "",
    "enable_vision_assist": true
  },
  "mode": "manual",
  "series": {
    "enabled": true,
    "series_id": "hxh6",
    "source_job_id": "manual-1792270006310",
    "part": 1,
    "start_seconds": 0,
    "context": "(No prior summaries.)"
  },
  "music": {
    "ref": "",
    "source": "default"
  },
  "version": 2,
  "job_id": "hxh6-p1",
  "saved_at_epoch": 1792305385
}