{
  "version": 2,
  "job_id": "manual-1789179504976",
  "source": {
    "kind": "magnet",
    "value": "magnet:?xt=urn:btih:ba270306e8dddf66f5a5ce4bafbd333902552035&dn=Rick and Morty - S02 - 2160p HDR Ai Upscale -Mesc&xl=19805339127&tr=https://seedpool.org/announce/9b684f045f3361654d93e5f1bd3514e7&tr=udp://open.stealth.si:80/announce&tr=udp://tracker.opentrackr.org:1337/announce&tr=udp://tracker.torrent.eu.org:451/announce&tr=udp://explodie.org:6969/announce&tr=udp://ttk2.nbaonlineservice.com:6969/announce&tr=udp://ec2-18-191-163-220.us-east-2.compute.amazonaws.com:6969/announce"
  },
  "options": {
    "whisper_model": "base",
    "language": "auto",
    "task": "translate_to_english",
    "target_duration_seconds": 30,
    "focus": "",
    "enable_vision_assist": true
  },
  "mode": "manual",
  "series": {
    "enabled": true,
    "series_id": "series-1789179512644",
    "source_job_id": "manual-1789179504976",
    "part": 1,
    "start_seconds": 0,
    "context": ""
  },
  "music": {
    "ref": "audio-library/180DB_ [130] (Intro Slowed).m4a",
    "source": "default"
  },
  "saved_at_epoch": 1789179512
}
