{
  "version": 2,
  "job_id": "series-1788373326501-p2",
  "source": {
    "kind": "torrent_file",
    "value": "path:jobs/manual-1788373299149/source.torrent",
    "torrent_file_index": "37"
  },
  "options": {
    "whisper_model": "base",
    "language": "auto",
    "task": "translate_to_english",
    "target_duration_seconds": 120,
    "focus": "",
    "enable_vision_assist": true
  },
  "mode": "manual",
  "series": {
    "enabled": true,
    "series_id": "series-1788373326501",
    "source_job_id": "manual-1788373299149",
    "part": 2,
    "start_seconds": 266,
    "context": "Prior events (Part 1): Light counts down the seconds expecting victory, but when the 40 seconds expire without a single death, Near reveals the tampered notebook with only Light's name missing, completely exposing him as Kira."
  },
  "music": {
    "ref": "audio-library/SUA CAVALONA (Hardstyle Remix) (Ultra Slowed).m4a",
    "source": "default"
  },
  "saved_at_epoch": 1788377882
}
