{
  "version": 2,
  "job_id": "manual-1790102858883",
  "source": {
    "kind": "torrent_file",
    "value": "path:jobs\/manual-1790102858883\/source.torrent"
  },
  "options": {
    "whisper_model": "base",
    "language": "auto",
    "task": "translate_to_english",
    "target_duration_seconds": 30,
    "focus": "",
    "enable_vision_assist": true
  },
  "mode": "manual",
  "series": {
    "enabled": true,
    "series_id": "hyakkano6",
    "source_job_id": "manual-1790102858883",
    "part": 1,
    "start_seconds": 0,
    "context": "",
    "super_series": true
  },
  "music": {
    "ref": "audio-library\/Dj_Quads_-_its_near_[No_Copyright_Music].m4a",
    "source": "explicit_library"
  },
  "saved_at_epoch": 1790102858
}